================================================================================
COMPREHENSIVE EMBEDDING AND SOLVING BENCHMARK v2.0
================================================================================
Testing: Formulations × Decompositions × Solvers
================================================================================

[1/6] Importing libraries...
  [OK] Imports done in 2.49s

================================================================================
COMPREHENSIVE EMBEDDING AND SOLVING BENCHMARK v2.0
================================================================================

[1/4] Initializing...
  Using simulated Pegasus P16 topology
  [OK] Target graph: 5640 nodes, 40484 edges
  Total configurations to test: 15
  Problem sizes: [25]
  Formulations: ['CQM', 'BQM', 'SparseBQM']
  Decompositions: ['None', 'Louvain', 'PlotBased', 'Multilevel', 'Cutset', 'SpatialGrid', 'EnergyImpact']

[2/4] Running experiments...

============================================================
PROBLEM SIZE: 25 farms × 27 foods = 675 variables
============================================================

  [1/15] n_farms=25, form=CQM, decomp=None
    Building CQM...
    Building Patch CQM (25 patches, 27 foods)...
    Solving CQM with Gurobi (no embedding for CQM)...
      Solving CQM (675 vars, 26 constraints)...
        [1/5] Creating Gurobi model...
Set parameter Username
Set parameter LicenseID to value 2728803
Academic license - for non-commercial use only - expires 2026-10-28
        [2/5] Adding variables...
        [3/5] Building objective (675 linear, 0 quadratic)...
        [4/5] Adding 26 constraints...
        [5/5] Optimizing...
        [DONE] in 0.00s (status=2)

  [2/15] n_farms=25, form=BQM, decomp=None
    Building BQM...
    Building Patch CQM (25 patches, 27 foods)...
    Converting Patch_CQM to BQM...
    Applying decomposition: None...
      Created 1 partition(s)
    Running embedding study...
      Testing embedding: 760 vars, 236370 edges (density=0.409)
      Running minorminer (timeout=300s)...
      [FAILED] No embedding (tried for 1076.3s)
    Solving with Gurobi...
      Solving BQM (760 vars, 236370 quad)...
        Creating model and optimizing...
        [DONE] in 300.62s (TIME_LIMIT, obj=-56.0000)
    Result: Embed=[NO] (1076.3s), Solve=[PARTIAL] (300.6s) [timeout], Total=1376.9s

  [3/15] n_farms=25, form=BQM, decomp=Louvain
    Building BQM...
    Building Patch CQM (25 patches, 27 foods)...
    Converting Patch_CQM to BQM...
    Applying decomposition: Louvain...
      Created 6 partition(s)
    Running embedding study...
      Embedding 6 partitions...
        Partition 1/6 (130 vars)...
      Testing embedding: 130 vars, 7239 edges (density=0.428)
      Running minorminer (timeout=300s)...
      [SUCCESS] Embedded in 310.1s (chains: max=27, mean=15.1)
        Partition 2/6 (150 vars)...
      Testing embedding: 150 vars, 9465 edges (density=0.421)
      Running minorminer (timeout=300s)...
      [SUCCESS] Embedded in 286.6s (chains: max=37, mean=23.4)
        Partition 3/6 (150 vars)...
      Testing embedding: 150 vars, 9465 edges (density=0.421)
      Running minorminer (timeout=300s)...
      [SUCCESS] Embedded in 235.9s (chains: max=26, mean=15.9)
        Partition 4/6 (150 vars)...
      Testing embedding: 150 vars, 9465 edges (density=0.421)
      Running minorminer (timeout=300s)...
      [SUCCESS] Embedded in 331.7s (chains: max=23, mean=15.4)
        Partition 5/6 (150 vars)...
      Testing embedding: 150 vars, 9465 edges (density=0.421)
      Running minorminer (timeout=300s)...
      [SUCCESS] Embedded in 302.3s (chains: max=33, mean=19.5)
        Partition 6/6 (30 vars)...
      Testing embedding: 30 vars, 435 edges (density=0.483)
      Running minorminer (timeout=300s)...
      [SUCCESS] Embedded in 6.4s (chains: max=5, mean=4.1)
    Solving with Gurobi...
      Solving 6 partitions with Gurobi...
      Solving BQM (130 vars, 7239 quad)...
        Creating model and optimizing...
        [DONE] in 300.04s (TIME_LIMIT, obj=-4557270.0000)
      Solving BQM (150 vars, 9465 quad)...
        Creating model and optimizing...
        [DONE] in 0.05s (OPTIMAL, obj=-1617435.0000)
      Solving BQM (150 vars, 9465 quad)...
        Creating model and optimizing...
        [DONE] in 0.04s (OPTIMAL, obj=-1617435.0000)
      Solving BQM (150 vars, 9465 quad)...
        Creating model and optimizing...
        [DONE] in 0.07s (OPTIMAL, obj=-1617435.0000)
      Solving BQM (150 vars, 9465 quad)...
        Creating model and optimizing...
        [DONE] in 0.04s (OPTIMAL, obj=-1617435.0000)
      Solving BQM (30 vars, 435 quad)...
        Creating model and optimizing...
        [DONE] in 0.00s (OPTIMAL, obj=-352647.0000)
    Result: Embed=[OK] (1473.0s), Solve=[PARTIAL] (300.3s) [5/6 optimal, 1 timeout], Total=1773.2s

  [4/15] n_farms=25, form=BQM, decomp=PlotBased
    Building BQM...
    Building Patch CQM (25 patches, 27 foods)...
    Converting Patch_CQM to BQM...
    Applying decomposition: PlotBased...
      Created 5 partition(s)
    Running embedding study...
      Embedding 5 partitions...
        Partition 1/5 (135 vars)...
      Testing embedding: 135 vars, 9045 edges (density=0.496)
      Running minorminer (timeout=300s)...
      [SUCCESS] Embedded in 316.3s (chains: max=30, mean=20.0)
        Partition 2/5 (135 vars)...
      Testing embedding: 135 vars, 9045 edges (density=0.496)
      Running minorminer (timeout=300s)...
      [SUCCESS] Embedded in 303.0s (chains: max=28, mean=17.2)
        Partition 3/5 (135 vars)...
      Testing embedding: 135 vars, 9045 edges (density=0.496)
      Running minorminer (timeout=300s)...
      [SUCCESS] Embedded in 314.5s (chains: max=35, mean=22.8)
        Partition 4/5 (135 vars)...
      Testing embedding: 135 vars, 9045 edges (density=0.496)
      Running minorminer (timeout=300s)...
      [SUCCESS] Embedded in 308.9s (chains: max=32, mean=21.2)
        Partition 5/5 (135 vars)...
      Testing embedding: 135 vars, 9045 edges (density=0.496)
      Running minorminer (timeout=300s)...
      [SUCCESS] Embedded in 304.6s (chains: max=39, mean=25.0)
    Solving with Gurobi...
      Solving 5 partitions with Gurobi...
      Solving BQM (135 vars, 9045 quad)...
        Creating model and optimizing...
        [DONE] in 0.04s (OPTIMAL, obj=-1617435.0000)
      Solving BQM (135 vars, 9045 quad)...
        Creating model and optimizing...
        [DONE] in 0.04s (OPTIMAL, obj=-1617435.0000)
      Solving BQM (135 vars, 9045 quad)...
        Creating model and optimizing...
        [DONE] in 0.05s (OPTIMAL, obj=-1617435.0000)
      Solving BQM (135 vars, 9045 quad)...
        Creating model and optimizing...
        [DONE] in 0.09s (OPTIMAL, obj=-1617435.0000)
      Solving BQM (135 vars, 9045 quad)...
        Creating model and optimizing...
        [DONE] in 0.05s (OPTIMAL, obj=-1617435.0000)
    Result: Embed=[OK] (1547.3s), Solve=[OK] (0.3s) [5/5 optimal], Total=1547.5s

  [5/15] n_farms=25, form=BQM, decomp=Multilevel
    Building BQM...
    Building Patch CQM (25 patches, 27 foods)...
    Converting Patch_CQM to BQM...
    Applying decomposition: Multilevel...
      Created 2 partition(s)
    Running embedding study...
      Embedding 2 partitions...
        Partition 1/2 (400 vars)...
      Testing embedding: 400 vars, 64211 edges (density=0.401)
      Running minorminer (timeout=300s)...
      [FAILED] No embedding (tried for 566.5s)
        Partition 2/2 (360 vars)...
      Testing embedding: 360 vars, 54096 edges (density=0.417)
      Running minorminer (timeout=300s).         [FAILED] No embedding (tried for 401.1s)
    Solving with Gurobi...
      Solving 2 partitions with Gurobi...
      Solving BQM (400 vars, 64211 quad)...
        Creating model and optimizing...
        [DONE] in 300.02s (TIME_LIMIT, obj=-4562624.0000)
      Solving BQM (360 vars, 54096 quad)...
        Creating model and optimizing...
        [DONE] in 0.27s (OPTIMAL, obj=-3760045.0000)
    Result: Embed=[NO] (967.6s), Solve=[PARTIAL] (300.3s) [1/2 optimal, 1 timeout], Total=1267.9s

  [6/15] n_farms=25, form=BQM, decomp=Cutset
    Building BQM...
    Building Patch CQM (25 patches, 27 foods)...
    Converting Patch_CQM to BQM...
    Applying decomposition: Cutset...
      Created 16 partition(s)
    Running embedding study...
      Embedding 16 partitions...
        Partition 1/16 (50 vars)...
      Testing embedding: 50 vars, 1225 edges (density=0.490)
      Running minorminer (timeout=300s)...
      [SUCCESS] Embedded in 13.4s (chains: max=8, mean=6.2)
        Partition 2/16 (50 vars)...
      Testing embedding: 50 vars, 1225 edges (density=0.490)
      Running minorminer (timeout=300s)...
      [SUCCESS] Embedded in 15.1s (chains: max=10, mean=6.8)
        Partition 3/16 (50 vars)...
      Testing embedding: 50 vars, 1225 edges (density=0.490)
      Running minorminer (timeout=300s)...
      [SUCCESS] Embedded in 15.6s (chains: max=11, mean=7.4)
        Partition 4/16 (50 vars)...
      Testing embedding: 50 vars, 1225 edges (density=0.490)
      Running minorminer (timeout=300s)...
      [SUCCESS] Embedded in 23.7s (chains: max=10, mean=6.7)
        Partition 5/16 (50 vars)...
      Testing embedding: 50 vars, 1225 edges (density=0.490)
      Running minorminer (timeout=300s)...
      [SUCCESS] Embedded in 37.5s (chains: max=8, mean=6.2)
        Partition 6/16 (50 vars)...
      Testing embedding: 50 vars, 1225 edges (density=0.490)
      Running minorminer (timeout=300s)...
      [SUCCESS] Embedded in 10.5s (chains: max=8, mean=6.2)
        Partition 7/16 (50 vars)...
      Testing embedding: 50 vars, 1225 edges (density=0.490)
      Running minorminer (timeout=300s)...
      [SUCCESS] Embedded in 26.9s (chains: max=9, mean=6.7)
        Partition 8/16 (50 vars)...
      Testing embedding: 50 vars, 1225 edges (density=0.490)
      Running minorminer (timeout=300s)...
      [SUCCESS] Embedded in 8.6s (chains: max=10, mean=6.1)
        Partition 9/16 (50 vars)...
      Testing embedding: 50 vars, 1225 edges (density=0.490)
      Running minorminer (timeout=300s)...
      [SUCCESS] Embedded in 14.2s (chains: max=9, mean=6.3)
        Partition 10/16 (50 vars)...
      Testing embedding: 50 vars, 1225 edges (density=0.490)
      Running minorminer (timeout=300s)...
      [SUCCESS] Embedded in 15.0s (chains: max=9, mean=6.5)
        Partition 11/16 (50 vars)...
      Testing embedding: 50 vars, 1225 edges (density=0.490)
      Running minorminer (timeout=300s)...
      [SUCCESS] Embedded in 19.0s (chains: max=7, mean=6.1)
        Partition 12/16 (50 vars)...
      Testing embedding: 50 vars, 1225 edges (density=0.490)
      Running minorminer (timeout=300s)...
      [SUCCESS] Embedded in 10.4s (chains: max=9, mean=6.3)
        Partition 13/16 (50 vars)...
      Testing embedding: 50 vars, 1225 edges (density=0.490)
      Running minorminer (timeout=300s)...
      [SUCCESS] Embedded in 12.2s (chains: max=9, mean=6.4)
        Partition 14/16 (50 vars)...
      Testing embedding: 50 vars, 324 edges (density=0.130)
      Running minorminer (timeout=300s)...
      [SUCCESS] Embedded in 1.7s (chains: max=5, mean=2.4)
        Partition 15/16 (50 vars)...
      Testing embedding: 50 vars, 49 edges (density=0.020)
      Running minorminer (timeout=300s)...
      [SUCCESS] Embedded in 0.1s (chains: max=1, mean=1.0)
        Partition 16/16 (10 vars)...
      Testing embedding: 10 vars, 45 edges (density=0.450)
      Running minorminer (timeout=300s)...
      [SUCCESS] Embedded in 0.2s (chains: max=2, mean=1.6)
    Solving with Gurobi...
      Solving 16 partitions with Gurobi...
      Solving BQM (50 vars, 1225 quad)...
        Creating model and optimizing...
        [DONE] in 0.01s (OPTIMAL, obj=-642470.0000)
      Solving BQM (50 vars, 1225 quad)...
        Creating model and optimizing...
        [DONE] in 0.01s (OPTIMAL, obj=-643990.0000)
      Solving BQM (50 vars, 1225 quad)...
        Creating model and optimizing...
        [DONE] in 0.01s (OPTIMAL, obj=-644870.0000)
      Solving BQM (50 vars, 1225 quad)...
        Creating model and optimizing...
        [DONE] in 0.01s (OPTIMAL, obj=-645110.0000)
      Solving BQM (50 vars, 1225 quad)...
        Creating model and optimizing...
        [DONE] in 0.01s (OPTIMAL, obj=-644710.0000)
      Solving BQM (50 vars, 1225 quad)...
        Creating model and optimizing...
        [DONE] in 0.01s (OPTIMAL, obj=-643670.0000)
      Solving BQM (50 vars, 1225 quad)...
        Creating model and optimizing...
        [DONE] in 0.01s (OPTIMAL, obj=-642530.0000)
      Solving BQM (50 vars, 1225 quad)...
        Creating model and optimizing...
        [DONE] in 0.01s (OPTIMAL, obj=-642910.0000)
      Solving BQM (50 vars, 1225 quad)...
        Creating model and optimizing...
        [DONE] in 0.01s (OPTIMAL, obj=-644270.0000)
      Solving BQM (50 vars, 1225 quad)...
        Creating model and optimizing...
        [DONE] in 0.01s (OPTIMAL, obj=-644990.0000)
      Solving BQM (50 vars, 1225 quad)...
        Creating model and optimizing...
        [DONE] in 0.01s (OPTIMAL, obj=-645070.0000)
      Solving BQM (50 vars, 1225 quad)...
        Creating model and optimizing...
        [DONE] in 0.01s (OPTIMAL, obj=-644510.0000)
      Solving BQM (50 vars, 1225 quad)...
        Creating model and optimizing...
        [DONE] in 0.01s (OPTIMAL, obj=-643310.0000)
      Solving BQM (50 vars, 324 quad)...
        Creating model and optimizing...
        [DONE] in 0.01s (OPTIMAL, obj=-329615.0000)
      Solving BQM (50 vars, 49 quad)...
        Creating model and optimizing...
        [DONE] in 0.00s (OPTIMAL, obj=-4240.0000)
      Solving BQM (10 vars, 45 quad)...
        Creating model and optimizing...
        [DONE] in 0.00s (OPTIMAL, obj=-4554560.0000)
    Result: Embed=[OK] (224.0s), Solve=[OK] (0.1s) [16/16 optimal], Total=224.1s

  [7/15] n_farms=25, form=BQM, decomp=SpatialGrid
    Building BQM...
    Building Patch CQM (25 patches, 27 foods)...
    Converting Patch_CQM to BQM...
    Applying decomposition: SpatialGrid...
      Created 5 partition(s)
    Running embedding study...
      Embedding 5 partitions...
        Partition 1/5 (135 vars)...
      Testing embedding: 135 vars, 9045 edges (density=0.496)
      Running minorminer (timeout=300s)...
      [SUCCESS] Embedded in 219.5s (chains: max=26, mean=17.4)
        Partition 2/5 (135 vars)...
      Testing embedding: 135 vars, 9045 edges (density=0.496)
      Running minorminer (timeout=300s)          [SUCCESS] Embedded in 303.0s (chains: max=28, mean=18.7)
        Partition 3/5 (135 vars)...
      Testing embedding: 135 vars, 9045 edges (density=0.496)
      Running minorminer (timeout=300s)          [SUCCESS] Embedded in 305.1s (chains: max=34, mean=19.1)
        Partition 4/5 (135 vars)...
      Testing embedding: 135 vars, 9045 edges (density=0.496)
      Running minorminer (timeout=300s)          [SUCCESS] Embedded in 235.1s (chains: max=32, mean=20.4)
        Partition 5/5 (135 vars)...
      Testing embedding: 135 vars, 9045 edges (density=0.496)
      Running minorminer (timeout=300s)      [SUCCESS] Embedded in 2099.3s (chains: max=29, mean=19.3)
    Solving with Gurobi...
      Solving 5 partitions with Gurobi...
      Solving BQM (135 vars, 9045 quad)...
        Creating model and optimizing...
        [DONE] in 0.04s (OPTIMAL, obj=-1617435.0000)
      Solving BQM (135 vars, 9045 quad)...
        Creating model and optimizing...
        [DONE] in 0.05s (OPTIMAL, obj=-1617435.0000)
      Solving BQM (135 vars, 9045 quad)...
        Creating model and optimizing...
        [DONE] in 0.04s (OPTIMAL, obj=-1617435.0000)
      Solving BQM (135 vars, 9045 quad)...
        Creating model and optimizing...
        [DONE] in 0.05s (OPTIMAL, obj=-1617435.0000)
      Solving BQM (135 vars, 9045 quad)...
        Creating model and optimizing...
        [DONE] in 0.04s (OPTIMAL, obj=-1617435.0000)
    Result: Embed=[OK] (3313.8s), Solve=[OK] (0.2s) [5/5 optimal], Total=3314.0s

  [8/15] n_farms=25, form=BQM, decomp=EnergyImpact
    Building BQM...
    Building Patch CQM (25 patches, 27 foods)...
    Converting Patch_CQM to BQM...
    Applying decomposition: EnergyImpact...
      Created 1 partition(s)
    Running embedding study...
      Testing embedding: 760 vars, 236370 edges (density=0.409)
      Running minorminer (timeout=300s)...
      [FAILED] No embedding (tried for 1280.2s)
    Solving with Gurobi...
      Solving BQM (760 vars, 236370 quad)...
        Creating model and optimizing...
        [DONE] in 300.14s (TIME_LIMIT, obj=-56.0000)
    Result: Embed=[NO] (1280.2s), Solve=[PARTIAL] (300.1s) [timeout], Total=1580.4s

  [9/15] n_farms=25, form=SparseBQM, decomp=None
    Building SparseBQM...
    Building Patch Ultra-Sparse BQM (25 patches, 27 foods)...
    Applying decomposition: None...
      Created 1 partition(s)
    Running embedding study...
      Testing embedding: 675 vars, 648 edges (density=0.001)
      Running minorminer (timeout=300s)...
      [SUCCESS] Embedded in 1.0s (chains: max=1, mean=1.0)
    Solving with Gurobi...
      Solving BQM (675 vars, 648 quad)...
        Creating model and optimizing...
        [DONE] in 0.01s (OPTIMAL, obj=-351.0000)
    Result: Embed=[OK] (1.0s), Solve=[OK] (0.0s), Total=1.0s

  [10/15] n_farms=25, form=SparseBQM, decomp=Louvain
    Building SparseBQM...
    Building Patch Ultra-Sparse BQM (25 patches, 27 foods)...
    Applying decomposition: Louvain...
      Created 5 partition(s)
    Running embedding study...
      Embedding 5 partitions...
        Partition 1/5 (150 vars)...
      Testing embedding: 150 vars, 144 edges (density=0.006)
      Running minorminer (timeout=300s)...
      [SUCCESS] Embedded in 0.2s (chains: max=1, mean=1.0)
        Partition 2/5 (150 vars)...
      Testing embedding: 150 vars, 144 edges (density=0.006)
      Running minorminer (timeout=300s)...
      [SUCCESS] Embedded in 0.2s (chains: max=1, mean=1.0)
        Partition 3/5 (150 vars)...
      Testing embedding: 150 vars, 144 edges (density=0.006)
      Running minorminer (timeout=300s)...
      [SUCCESS] Embedded in 0.2s (chains: max=1, mean=1.0)
        Partition 4/5 (150 vars)...
      Testing embedding: 150 vars, 144 edges (density=0.006)
      Running minorminer (timeout=300s)...
      [SUCCESS] Embedded in 0.2s (chains: max=1, mean=1.0)
        Partition 5/5 (75 vars)...
      Testing embedding: 75 vars, 72 edges (density=0.013)
      Running minorminer (timeout=300s)...
      [SUCCESS] Embedded in 0.1s (chains: max=1, mean=1.0)
    Solving with Gurobi...
      Solving 5 partitions with Gurobi...
      Solving BQM (150 vars, 144 quad)...
        Creating model and optimizing...
        [DONE] in 0.01s (OPTIMAL, obj=-78.0000)
      Solving BQM (150 vars, 144 quad)...
        Creating model and optimizing...
        [DONE] in 0.01s (OPTIMAL, obj=-78.0000)
      Solving BQM (150 vars, 144 quad)...
        Creating model and optimizing...
        [DONE] in 0.01s (OPTIMAL, obj=-78.0000)
      Solving BQM (150 vars, 144 quad)...
        Creating model and optimizing...
        [DONE] in 0.00s (OPTIMAL, obj=-78.0000)
      Solving BQM (75 vars, 72 quad)...
        Creating model and optimizing...
        [DONE] in 0.00s (OPTIMAL, obj=-39.0000)
    Result: Embed=[OK] (1.0s), Solve=[OK] (0.0s) [5/5 optimal], Total=1.0s

  [11/15] n_farms=25, form=SparseBQM, decomp=PlotBased
    Building SparseBQM...
    Building Patch Ultra-Sparse BQM (25 patches, 27 foods)...
    Applying decomposition: PlotBased...
      Created 5 partition(s)
    Running embedding study...
      Embedding 5 partitions...
        Partition 1/5 (135 vars)...
      Testing embedding: 135 vars, 108 edges (density=0.006)
      Running minorminer (timeout=300s)...
      [SUCCESS] Embedded in 0.2s (chains: max=1, mean=1.0)
        Partition 2/5 (135 vars)...
      Testing embedding: 135 vars, 108 edges (density=0.006)
      Running minorminer (timeout=300s)...
      [SUCCESS] Embedded in 0.2s (chains: max=1, mean=1.0)
        Partition 3/5 (135 vars)...
      Testing embedding: 135 vars, 108 edges (density=0.006)
      Running minorminer (timeout=300s)...
      [SUCCESS] Embedded in 0.2s (chains: max=1, mean=1.0)
        Partition 4/5 (135 vars)...
      Testing embedding: 135 vars, 108 edges (density=0.006)
      Running minorminer (timeout=300s)...
      [SUCCESS] Embedded in 0.2s (chains: max=1, mean=1.0)
        Partition 5/5 (135 vars)...
      Testing embedding: 135 vars, 108 edges (density=0.006)
      Running minorminer (timeout=300s)...
      [SUCCESS] Embedded in 0.2s (chains: max=1, mean=1.0)
    Solving with Gurobi...
      Solving 5 partitions with Gurobi...
      Solving BQM (135 vars, 108 quad)...
        Creating model and optimizing...
        [DONE] in 0.00s (OPTIMAL, obj=-81.0000)
      Solving BQM (135 vars, 108 quad)...
        Creating model and optimizing...
        [DONE] in 0.01s (OPTIMAL, obj=-81.0000)
      Solving BQM (135 vars, 108 quad)...
        Creating model and optimizing...
        [DONE] in 0.01s (OPTIMAL, obj=-81.0000)
      Solving BQM (135 vars, 108 quad)...
        Creating model and optimizing...
        [DONE] in 0.00s (OPTIMAL, obj=-81.0000)
      Solving BQM (135 vars, 108 quad)...
        Creating model and optimizing...
        [DONE] in 0.00s (OPTIMAL, obj=-81.0000)
    Result: Embed=[OK] (1.0s), Solve=[OK] (0.0s) [5/5 optimal], Total=1.0s

  [12/15] n_farms=25, form=SparseBQM, decomp=Multilevel
    Building SparseBQM...
    Building Patch Ultra-Sparse BQM (25 patches, 27 foods)...
    Applying decomposition: Multilevel...
      Created 2 partition(s)
    Running embedding study...
      Embedding 2 partitions...
        Partition 1/2 (356 vars)...
      Testing embedding: 356 vars, 341 edges (density=0.003)
      Running minorminer (timeout=300s)...
      [SUCCESS] Embedded in 0.6s (chains: max=1, mean=1.0)
        Partition 2/2 (319 vars)...
      Testing embedding: 319 vars, 305 edges (density=0.003)
      Running minorminer (timeout=300s)...
      [SUCCESS] Embedded in 0.6s (chains: max=1, mean=1.0)
    Solving with Gurobi...
      Solving 2 partitions with Gurobi...
      Solving BQM (356 vars, 341 quad)...
        Creating model and optimizing...
        [DONE] in 0.01s (OPTIMAL, obj=-185.5000)
      Solving BQM (319 vars, 305 quad)...
        Creating model and optimizing...
        [DONE] in 0.01s (OPTIMAL, obj=-166.5000)
    Result: Embed=[OK] (1.3s), Solve=[OK] (0.0s) [2/2 optimal], Total=1.3s

  [13/15] n_farms=25, form=SparseBQM, decomp=Cutset
    Building SparseBQM...
    Building Patch Ultra-Sparse BQM (25 patches, 27 foods)...
    Applying decomposition: Cutset...
      Created 14 partition(s)
    Running embedding study...
      Embedding 14 partitions...
        Partition 1/14 (50 vars)...
      Testing embedding: 50 vars, 23 edges (density=0.009)
      Running minorminer (timeout=300s)...
      [SUCCESS] Embedded in 0.1s (chains: max=1, mean=1.0)
        Partition 2/14 (50 vars)...
      Testing embedding: 50 vars, 23 edges (density=0.009)
      Running minorminer (timeout=300s)...
      [SUCCESS] Embedded in 0.1s (chains: max=1, mean=1.0)
        Partition 3/14 (50 vars)...
      Testing embedding: 50 vars, 23 edges (density=0.009)
      Running minorminer (timeout=300s)...
      [SUCCESS] Embedded in 0.1s (chains: max=1, mean=1.0)
        Partition 4/14 (50 vars)...
      Testing embedding: 50 vars, 23 edges (density=0.009)
      Running minorminer (timeout=300s)...
      [SUCCESS] Embedded in 0.1s (chains: max=1, mean=1.0)
        Partition 5/14 (50 vars)...
      Testing embedding: 50 vars, 23 edges (density=0.009)
      Running minorminer (timeout=300s)...
      [SUCCESS] Embedded in 0.1s (chains: max=1, mean=1.0)
        Partition 6/14 (50 vars)...
      Testing embedding: 50 vars, 23 edges (density=0.009)
      Running minorminer (timeout=300s)...
      [SUCCESS] Embedded in 0.1s (chains: max=1, mean=1.0)
        Partition 7/14 (50 vars)...
      Testing embedding: 50 vars, 23 edges (density=0.009)
      Running minorminer (timeout=300s)...
      [SUCCESS] Embedded in 0.1s (chains: max=1, mean=1.0)
        Partition 8/14 (50 vars)...
      Testing embedding: 50 vars, 23 edges (density=0.009)
      Running minorminer (timeout=300s)...
      [SUCCESS] Embedded in 0.1s (chains: max=1, mean=1.0)
        Partition 9/14 (50 vars)...
      Testing embedding: 50 vars, 23 edges (density=0.009)
      Running minorminer (timeout=300s)...
      [SUCCESS] Embedded in 0.1s (chains: max=1, mean=1.0)
        Partition 10/14 (50 vars)...
      Testing embedding: 50 vars, 23 edges (density=0.009)
      Running minorminer (timeout=300s)...
      [SUCCESS] Embedded in 0.1s (chains: max=1, mean=1.0)
        Partition 11/14 (50 vars)...
      Testing embedding: 50 vars, 23 edges (density=0.009)
      Running minorminer (timeout=300s)...
      [SUCCESS] Embedded in 0.1s (chains: max=1, mean=1.0)
        Partition 12/14 (50 vars)...
      Testing embedding: 50 vars, 23 edges (density=0.009)
      Running minorminer (timeout=300s)...
      [SUCCESS] Embedded in 0.1s (chains: max=1, mean=1.0)
        Partition 13/14 (50 vars)...
      Testing embedding: 50 vars, 23 edges (density=0.009)
      Running minorminer (timeout=300s)...
      [SUCCESS] Embedded in 0.1s (chains: max=1, mean=1.0)
        Partition 14/14 (25 vars)...
      Testing embedding: 25 vars, 0 edges (density=0.000)
      Running minorminer (timeout=300s)...
      [SUCCESS] Embedded in 0.0s (chains: max=1, mean=1.0)
    Solving with Gurobi...
      Solving 14 partitions with Gurobi...
      Solving BQM (50 vars, 23 quad)...
        Creating model and optimizing...
        [DONE] in 0.00s (OPTIMAL, obj=-38.5000)
      Solving BQM (50 vars, 23 quad)...
        Creating model and optimizing...
        [DONE] in 0.00s (OPTIMAL, obj=-38.5000)
      Solving BQM (50 vars, 23 quad)...
        Creating model and optimizing...
        [DONE] in 0.00s (OPTIMAL, obj=-38.5000)
      Solving BQM (50 vars, 23 quad)...
        Creating model and optimizing...
        [DONE] in 0.00s (OPTIMAL, obj=-38.5000)
      Solving BQM (50 vars, 23 quad)...
        Creating model and optimizing...
        [DONE] in 0.00s (OPTIMAL, obj=-38.5000)
      Solving BQM (50 vars, 23 quad)...
        Creating model and optimizing...
        [DONE] in 0.00s (OPTIMAL, obj=-38.5000)
      Solving BQM (50 vars, 23 quad)...
        Creating model and optimizing...
        [DONE] in 0.00s (OPTIMAL, obj=-38.5000)
      Solving BQM (50 vars, 23 quad)...
        Creating model and optimizing...
        [DONE] in 0.00s (OPTIMAL, obj=-38.5000)
      Solving BQM (50 vars, 23 quad)...
        Creating model and optimizing...
        [DONE] in 0.00s (OPTIMAL, obj=-38.5000)
      Solving BQM (50 vars, 23 quad)...
        Creating model and optimizing...
        [DONE] in 0.00s (OPTIMAL, obj=-38.5000)
      Solving BQM (50 vars, 23 quad)...
        Creating model and optimizing...
        [DONE] in 0.00s (OPTIMAL, obj=-38.5000)
      Solving BQM (50 vars, 23 quad)...
        Creating model and optimizing...
        [DONE] in 0.00s (OPTIMAL, obj=-38.5000)
      Solving BQM (50 vars, 23 quad)...
        Creating model and optimizing...
        [DONE] in 0.00s (OPTIMAL, obj=-38.5000)
      Solving BQM (25 vars, 0 quad)...
        Creating model and optimizing...
        [DONE] in 0.00s (OPTIMAL, obj=-25.0000)
    Result: Embed=[OK] (1.0s), Solve=[OK] (0.0s) [14/14 optimal], Total=1.1s

  [14/15] n_farms=25, form=SparseBQM, decomp=SpatialGrid
    Building SparseBQM...
    Building Patch Ultra-Sparse BQM (25 patches, 27 foods)...
    Applying decomposition: SpatialGrid...
      Created 5 partition(s)
    Running embedding study...
      Embedding 5 partitions...
        Partition 1/5 (135 vars)...
      Testing embedding: 135 vars, 108 edges (density=0.006)
      Running minorminer (timeout=300s)...
      [SUCCESS] Embedded in 0.2s (chains: max=1, mean=1.0)
        Partition 2/5 (135 vars)...
      Testing embedding: 135 vars, 108 edges (density=0.006)
      Running minorminer (timeout=300s)...
      [SUCCESS] Embedded in 0.2s (chains: max=1, mean=1.0)
        Partition 3/5 (135 vars)...
      Testing embedding: 135 vars, 108 edges (density=0.006)
      Running minorminer (timeout=300s)...
      [SUCCESS] Embedded in 0.2s (chains: max=1, mean=1.0)
        Partition 4/5 (135 vars)...
      Testing embedding: 135 vars, 108 edges (density=0.006)
      Running minorminer (timeout=300s)...
      [SUCCESS] Embedded in 0.2s (chains: max=1, mean=1.0)
        Partition 5/5 (135 vars)...
      Testing embedding: 135 vars, 108 edges (density=0.006)
      Running minorminer (timeout=300s)...
      [SUCCESS] Embedded in 0.2s (chains: max=1, mean=1.0)
    Solving with Gurobi...
      Solving 5 partitions with Gurobi...
      Solving BQM (135 vars, 108 quad)...
        Creating model and optimizing...
        [DONE] in 0.00s (OPTIMAL, obj=-81.0000)
      Solving BQM (135 vars, 108 quad)...
        Creating model and optimizing...
        [DONE] in 0.00s (OPTIMAL, obj=-81.0000)
      Solving BQM (135 vars, 108 quad)...
        Creating model and optimizing...
        [DONE] in 0.00s (OPTIMAL, obj=-81.0000)
      Solving BQM (135 vars, 108 quad)...
        Creating model and optimizing...
        [DONE] in 0.00s (OPTIMAL, obj=-81.0000)
      Solving BQM (135 vars, 108 quad)...
        Creating model and optimizing...
        [DONE] in 0.00s (OPTIMAL, obj=-81.0000)
    Result: Embed=[OK] (0.8s), Solve=[OK] (0.0s) [5/5 optimal], Total=0.9s

  [15/15] n_farms=25, form=SparseBQM, decomp=EnergyImpact
    Building SparseBQM...
    Building Patch Ultra-Sparse BQM (25 patches, 27 foods)...
    Applying decomposition: EnergyImpact...
      Created 1 partition(s)
    Running embedding study...
      Testing embedding: 675 vars, 648 edges (density=0.001)
      Running minorminer (timeout=300s)...
      [SUCCESS] Embedded in 0.8s (chains: max=1, mean=1.0)
    Solving with Gurobi...
      Solving BQM (675 vars, 648 quad)...
        Creating model and optimizing...
        [DONE] in 0.01s (OPTIMAL, obj=-351.0000)
    Result: Embed=[OK] (0.8s), Solve=[OK] (0.0s), Total=0.8s

[3/4] Saving results...
  [OK] JSON: /Users/edoardospigarolo/Documents/OQI-UC002-DWave/@todo/benchmark_results/benchmark_results_20251128_134743.json
  [OK] CSV: /Users/edoardospigarolo/Documents/OQI-UC002-DWave/@todo/benchmark_results/benchmark_results_20251128_134743.csv
  [OK] Markdown: /Users/edoardospigarolo/Documents/OQI-UC002-DWave/@todo/benchmark_results/benchmark_summary_20251128_134743.md

[4/4] Summary...

================================================================================
BENCHMARK COMPLETE
================================================================================
Total experiments: 15
Total benchmark time: 10998.1s (183.3 min)

Successful embeddings: 11/14
Successful solves: 11/15

Best configurations by problem size (by total time):
  25 farms: CQM + None (0.0s total)

Output files:
  - /Users/edoardospigarolo/Documents/OQI-UC002-DWave/@todo/benchmark_results/benchmark_results_20251128_134743.json
  - /Users/edoardospigarolo/Documents/OQI-UC002-DWave/@todo/benchmark_results/benchmark_results_20251128_134743.csv
  - /Users/edoardospigarolo/Documents/OQI-UC002-DWave/@todo/benchmark_results/benchmark_summary_20251128_134743.md
.md
